{
  "schema_version": "1.0",
  "proposal_id": "0e4b9c7a-2f1d-4c3e-9a8b-7d6c5e4f3a21",
  "tenant_id": "11111111-1111-4111-8111-111111111111",
  "candidate_id": "5a6b7c8d-9e0f-4a1b-8c2d-3e4f5a6b7c8d",
  "operation": "add_optional_property",
  "target_ref": "eios:property:Product.material",
  "parent_schema_version": 3,
  "parent_schema_digest": "1111111111111111111111111111111111111111111111111111111111111111",
  "change_digest": "2222222222222222222222222222222222222222222222222222222222222222",
  "source": {
    "input_snapshot_digest": "3333333333333333333333333333333333333333333333333333333333333333",
    "candidate_definition_ids": [],
    "claim_ids": ["4444444444444444444444444444444444444444444444444444444444444444"]
  },
  "compatibility_report_digest": "5555555555555555555555555555555555555555555555555555555555555555",
  "permission_proof_digest": "6666666666666666666666666666666666666666666666666666666666666666",
  "status": "frozen",
  "permit_ref": null,
  "frozen_at": "2026-10-20T13:00:00Z"
}
